{
  "schema": "treatcode.intelligence.repository-task.v3.1",
  "version": "3.1",
  "task_id": "TC-V31-PILOT-011",
  "title": "Spill-slot lifetime reuse",
  "phase": "pilot",
  "initial_signal": "Register-pressure lowering aliases two spill slots across a branch join and only fails after a nested call.",
  "known_failing_command_id": "pilot.public",
  "public_command_ids": [
    "pilot.public"
  ],
  "required_trit_change": true,
  "files": [
    {
      "path": "build/task-config.json",
      "editable": false,
      "sha256": "1de5deeaa8d18d70d863d38c140dfff4f71a7e286959182977c83e99c3696a51"
    },
    {
      "path": "native/contract.cpp",
      "editable": true,
      "sha256": "ba525eb0b0b30a7ffd6a5fb4024a5a9713995cf2e384d17073a4f06859e81aba"
    },
    {
      "path": "public/cases.json",
      "editable": false,
      "sha256": "ac8bbd402bc0008f34b67d80e427da5dc816dd4b82b52313747d67b2a479a36d"
    },
    {
      "path": "README.md",
      "editable": false,
      "sha256": "19ca3e856aed353d256e8b3759737a505e03f58a92d2606fa265f3c29537670d"
    },
    {
      "path": "src/distractor.trit",
      "editable": false,
      "sha256": "3a280607981afb7ab31a7fe6cbdc362f6153bbe6608dfb78cacb915da48b27c1"
    },
    {
      "path": "src/finalize.trit",
      "editable": true,
      "sha256": "6d0f2b3cf5708cb7be2be99ddeeeaf6a0a9be0e11999679b085c1e97920949c1"
    },
    {
      "path": "src/normalize.trit",
      "editable": true,
      "sha256": "d9a14870e824da936727343f37c438b231215333698ceb17e9f7a395b7ced575"
    },
    {
      "path": "src/transition.trit",
      "editable": true,
      "sha256": "24a97738dfe56621fe961055420ce6fb7e3ea390919c81fa3472772b7d6fa5de"
    }
  ],
  "limits": {
    "wall_clock_ms": 1200000,
    "cpu_ms": 1200000,
    "memory_mb": 512,
    "process_count": 8,
    "output_bytes": 262144,
    "maximum_changed_files": 4
  }
}
