{
  "schema": "treatcode.intelligence.repository-task.v3.1",
  "version": "3.1",
  "task_id": "TC-V31-PILOT-018",
  "title": "Redo-WAL recovery fence",
  "phase": "pilot",
  "initial_signal": "Recovery replays committed values but advances the durable watermark across an incomplete ternary record.",
  "known_failing_command_id": "pilot.public",
  "public_command_ids": [
    "pilot.public"
  ],
  "required_trit_change": true,
  "files": [
    {
      "path": "build/task-config.json",
      "editable": false,
      "sha256": "d4f2e22acde018217a9934c02844098aa8fdce6d472dcf37e59f75dfcfb2e90b"
    },
    {
      "path": "native/contract.cpp",
      "editable": true,
      "sha256": "d43fa3fbc3c1cf644f68111636ec271e761376aecd38db42b506131e12bf84d2"
    },
    {
      "path": "public/cases.json",
      "editable": false,
      "sha256": "5fc5713abc53e3862951b3d5a12421cf502601934a991cd25cceb398ca35893a"
    },
    {
      "path": "README.md",
      "editable": false,
      "sha256": "560f9905ab92f4c40f71763d7be7c49813ed93337098fbd27f20136fed0a0ac5"
    },
    {
      "path": "src/distractor.trit",
      "editable": false,
      "sha256": "62868ae71eeca179315d7d8878e2275362fb3999494b8cc9d5dcde73110c6a55"
    },
    {
      "path": "src/finalize.trit",
      "editable": true,
      "sha256": "a38a428bc7adc4bb4586bbcadb6b612d90053744e8d953e452ba81207d3f380d"
    },
    {
      "path": "src/normalize.trit",
      "editable": true,
      "sha256": "0618ad6aa699c1eda588ae50d861dd77d50038ac6304b37b74e6df4a25950a5a"
    },
    {
      "path": "src/transition.trit",
      "editable": true,
      "sha256": "83188116c7bdbff37f09f37554e66f1f0f6d2b7421d8f0dbbb81138d4d4402c6"
    }
  ],
  "limits": {
    "wall_clock_ms": 1200000,
    "cpu_ms": 1200000,
    "memory_mb": 512,
    "process_count": 8,
    "output_bytes": 262144,
    "maximum_changed_files": 4
  }
}
