{
  "schema": "treatcode.intelligence.repository-task.v3.1",
  "version": "3.1",
  "task_id": "TC-V31-PILOT-006",
  "title": "Checked ternary multiply",
  "phase": "pilot",
  "initial_signal": "Overflow detection rejects valid negative products and accepts one boundary product whose magnitude is unrepresentable.",
  "known_failing_command_id": "pilot.public",
  "public_command_ids": [
    "pilot.public"
  ],
  "required_trit_change": true,
  "files": [
    {
      "path": "bridge/contract.txt",
      "editable": true,
      "sha256": "bd975ad2fec2f9181523322607fd6bc51dd90ed8e60cf6f43ac2ef6b45e246b1"
    },
    {
      "path": "build/task-config.json",
      "editable": false,
      "sha256": "53546aa6dca62a1036be2fbba8c69edbdce1702d2fb08b95141406dbc79bdd45"
    },
    {
      "path": "public/cases.json",
      "editable": false,
      "sha256": "83fc817d46d5424e0a25c48f698f1a063aeaf0ac8cc7971be6465b9003e8b47d"
    },
    {
      "path": "README.md",
      "editable": false,
      "sha256": "21f87c9abbaf7e92045796e263cd0d1101461439bc8eb00d24bf409934a94fb2"
    },
    {
      "path": "src/distractor.trit",
      "editable": false,
      "sha256": "7e33653e518b2c963a326bd593fb6f76c1708943104c57e87b5e36ce2b68c1bd"
    },
    {
      "path": "src/finalize.trit",
      "editable": true,
      "sha256": "a38a428bc7adc4bb4586bbcadb6b612d90053744e8d953e452ba81207d3f380d"
    },
    {
      "path": "src/normalize.trit",
      "editable": true,
      "sha256": "e9cd4ca87395e15aeb11e44f15879e37c0946bb1295f65e6a3ad689ef587e484"
    },
    {
      "path": "src/transition.trit",
      "editable": true,
      "sha256": "24a97738dfe56621fe961055420ce6fb7e3ea390919c81fa3472772b7d6fa5de"
    }
  ],
  "limits": {
    "wall_clock_ms": 1200000,
    "cpu_ms": 1200000,
    "memory_mb": 512,
    "process_count": 8,
    "output_bytes": 262144,
    "maximum_changed_files": 4
  }
}
