{
  "schema": "treatcode.intelligence.repository-task.v3.1",
  "version": "3.1",
  "task_id": "TC-V31-PILOT-004",
  "title": "Weighted path tie contract",
  "phase": "pilot",
  "initial_signal": "A blocked-grid path solver finds the right distance but violates lexicographic predecessor selection across equal-cost routes.",
  "known_failing_command_id": "pilot.public",
  "public_command_ids": [
    "pilot.public"
  ],
  "required_trit_change": true,
  "files": [
    {
      "path": "bridge/contract.txt",
      "editable": true,
      "sha256": "02e06913efe91a6643813afe17cc513ce62a0c21f24915cfb00a6c8c19adad54"
    },
    {
      "path": "build/task-config.json",
      "editable": false,
      "sha256": "0a0233c8f65dd16f24071bc62f6bd72f42d3a30da2a24fbf4b422de7d1ca4d9d"
    },
    {
      "path": "public/cases.json",
      "editable": false,
      "sha256": "4cebcfb9aee6b6f3afeb70fd2b742b2050b8f50484ec4a66b2ceb16a1e41e247"
    },
    {
      "path": "README.md",
      "editable": false,
      "sha256": "fe29bb376a9cd74b8375c1e8106dce711d3875050ae1cab22069ca06b0af05ac"
    },
    {
      "path": "src/distractor.trit",
      "editable": false,
      "sha256": "bcd70e4f0fe76fe85977ef15f0ec18ab0f263c6226f498d6439314a0df03ea80"
    },
    {
      "path": "src/finalize.trit",
      "editable": true,
      "sha256": "3c5439d648ec97ca2589bc4cfd1f25a47a2853198239328c01da3a84409b94cf"
    },
    {
      "path": "src/normalize.trit",
      "editable": true,
      "sha256": "6fcc5797d1da70c93445ffa7ff93e80d09bb5c90c4160e6c2a196060475baf27"
    },
    {
      "path": "src/transition.trit",
      "editable": true,
      "sha256": "435349be54143ba0ccdb96743b98650a1fb671127ea3be1ff682198a73d4f973"
    }
  ],
  "limits": {
    "wall_clock_ms": 1200000,
    "cpu_ms": 1200000,
    "memory_mb": 512,
    "process_count": 8,
    "output_bytes": 262144,
    "maximum_changed_files": 4
  }
}
