{
  "schema": "treatcode.intelligence.repository-task.v3.1",
  "version": "3.1",
  "task_id": "TC-V31-PILOT-013",
  "title": "Alias-range validator",
  "phase": "pilot",
  "initial_signal": "Half-open pointer spans pass independently but their overflow-safe alias check misses a wrapped overlap.",
  "known_failing_command_id": "pilot.public",
  "public_command_ids": [
    "pilot.public"
  ],
  "required_trit_change": true,
  "files": [
    {
      "path": "build/task-config.json",
      "editable": false,
      "sha256": "ee4e7da0667e7df6a0a2d08ed36a55c9a7366c8a816ab684b42319527636f5ca"
    },
    {
      "path": "native/contract.cpp",
      "editable": true,
      "sha256": "d4bffc2860497765af9cafda819ec41c0ef76b7816577647fa720db0cb3b4691"
    },
    {
      "path": "public/cases.json",
      "editable": false,
      "sha256": "d5d858cc72d2dea84c37a8533d1b55a9b4445aa92dbaecf153d3c58d217fe3d1"
    },
    {
      "path": "README.md",
      "editable": false,
      "sha256": "cd8ad4cfddebc9264f41bcae6a45324b6e4a8481158dd0d31c6ca31c1f3764b9"
    },
    {
      "path": "src/distractor.trit",
      "editable": false,
      "sha256": "4b7df2854ded97659992716abf9823e68dec79f98ba9cbc2e9a63198a7ab2a6c"
    },
    {
      "path": "src/finalize.trit",
      "editable": true,
      "sha256": "9e9bdb339b638fb5236eb1bf0a4777e41ee83b3fcc516a6c6e97806129260cc9"
    },
    {
      "path": "src/normalize.trit",
      "editable": true,
      "sha256": "c3e60cacc366d482143ba4263d9cd620979ee5b389da9c2c780e2da53b9fa51c"
    },
    {
      "path": "src/transition.trit",
      "editable": true,
      "sha256": "83188116c7bdbff37f09f37554e66f1f0f6d2b7421d8f0dbbb81138d4d4402c6"
    }
  ],
  "limits": {
    "wall_clock_ms": 1200000,
    "cpu_ms": 1200000,
    "memory_mb": 512,
    "process_count": 8,
    "output_bytes": 262144,
    "maximum_changed_files": 4
  }
}
