{
  "schema": "treatcode.intelligence.repository-task.v3.1",
  "version": "3.1",
  "task_id": "TC-V31-PILOT-008",
  "title": "Recovering precedence parser",
  "phase": "pilot",
  "initial_signal": "Malformed nested ternary expressions shift associativity after recovery and poison the following declaration.",
  "known_failing_command_id": "pilot.public",
  "public_command_ids": [
    "pilot.public"
  ],
  "required_trit_change": true,
  "files": [
    {
      "path": "build/task-config.json",
      "editable": false,
      "sha256": "3b7dadee857a6849c06c97fc246b71006b37614bee8e38ab2062964271c67127"
    },
    {
      "path": "native/contract.cpp",
      "editable": true,
      "sha256": "ab2234cfd0f3454a5171da89e1b705bc640cad4c4671ea8b60cc5100bf3e80d4"
    },
    {
      "path": "public/cases.json",
      "editable": false,
      "sha256": "20c635c71f1f9c8f6d3e2904d7b76532e9e7169fc1a63c6406af901f8fdb9d0c"
    },
    {
      "path": "README.md",
      "editable": false,
      "sha256": "28deb5756095631f655ff85d38e4ca43d992f5990af9b8bae45b38b31b2826d7"
    },
    {
      "path": "src/distractor.trit",
      "editable": false,
      "sha256": "76bf561ce0c67d6f1a439addf6b4adeb466d445cb8772a889a314ca58a16738f"
    },
    {
      "path": "src/finalize.trit",
      "editable": true,
      "sha256": "3c5439d648ec97ca2589bc4cfd1f25a47a2853198239328c01da3a84409b94cf"
    },
    {
      "path": "src/normalize.trit",
      "editable": true,
      "sha256": "9e6ab9bd40c7e2041d5e7e0267140b0d39b338974135c637dfc32b91ba8acabe"
    },
    {
      "path": "src/transition.trit",
      "editable": true,
      "sha256": "83188116c7bdbff37f09f37554e66f1f0f6d2b7421d8f0dbbb81138d4d4402c6"
    }
  ],
  "limits": {
    "wall_clock_ms": 1200000,
    "cpu_ms": 1200000,
    "memory_mb": 512,
    "process_count": 8,
    "output_bytes": 262144,
    "maximum_changed_files": 4
  }
}
