{
  "schema": "treatcode.intelligence.repository-task.v3.1",
  "version": "3.1",
  "task_id": "TC-V31-PILOT-022",
  "title": "Configuration precedence repair",
  "phase": "pilot",
  "initial_signal": "Environment, manifest, and runtime overrides produce different effective limits in the CLI and service paths.",
  "known_failing_command_id": "pilot.public",
  "public_command_ids": [
    "pilot.public"
  ],
  "required_trit_change": true,
  "files": [
    {
      "path": "bridge/contract.ts",
      "editable": true,
      "sha256": "2ffcd660c9f7f90e745a298fb8a73e2e0dd0772c82ad0dfea71d5ef215495e8e"
    },
    {
      "path": "build/task-config.json",
      "editable": false,
      "sha256": "adb242c803d4c1945d7c57f7e7381a4b5bf9373267bffc800b63cf1d414de500"
    },
    {
      "path": "public/cases.json",
      "editable": false,
      "sha256": "27394e420fb580868cdfca732377cba53468bac76a934e03ae6aa8df94dcc01e"
    },
    {
      "path": "README.md",
      "editable": false,
      "sha256": "94350db6ededdbd8f83cb7d8bc07d2b04a16f7fe5d72f129c0a263fd607c2c51"
    },
    {
      "path": "src/distractor.trit",
      "editable": false,
      "sha256": "eb84cfb7bd61a18d9a368b3ee5211b5e959fd68d447194f625289de10365870a"
    },
    {
      "path": "src/finalize.trit",
      "editable": true,
      "sha256": "a38a428bc7adc4bb4586bbcadb6b612d90053744e8d953e452ba81207d3f380d"
    },
    {
      "path": "src/normalize.trit",
      "editable": true,
      "sha256": "b31b20976873a9634d3bbbba2dabe990e8f0d360babc36539232330962474252"
    },
    {
      "path": "src/transition.trit",
      "editable": true,
      "sha256": "a07d9cb2af0134fe2a48cd16ea882fdbcf95d2b3a5961101d94090cd2db841b7"
    }
  ],
  "limits": {
    "wall_clock_ms": 1200000,
    "cpu_ms": 1200000,
    "memory_mb": 512,
    "process_count": 8,
    "output_bytes": 262144,
    "maximum_changed_files": 4
  }
}
