{
  "schema": "treatcode.intelligence.repository-task.v3.1",
  "version": "3.1",
  "task_id": "TC-V31-PILOT-003",
  "title": "Nested rollback union-find",
  "phase": "pilot",
  "initial_signal": "Nested checkpoints restore parents but corrupt rank and component counts after path compression.",
  "known_failing_command_id": "pilot.public",
  "public_command_ids": [
    "pilot.public"
  ],
  "required_trit_change": true,
  "files": [
    {
      "path": "build/task-config.json",
      "editable": false,
      "sha256": "c9e8a85addffa40363510fc94b7e01008bd2397196eed6644e26dbd64ea63fa4"
    },
    {
      "path": "native/contract.cpp",
      "editable": true,
      "sha256": "9f05973cc54caf592f7ca7b36a519f49bf7a78cafc996ec2975a93566e221a2d"
    },
    {
      "path": "public/cases.json",
      "editable": false,
      "sha256": "8c4326841dd4fb906a5f376dc46b6e2229517fc8e8d7facc9d5964579eaa1fae"
    },
    {
      "path": "README.md",
      "editable": false,
      "sha256": "585cdaef48013ab8e678c7308673e771f6e139acbe3b45bbdf38e88fa6852005"
    },
    {
      "path": "src/distractor.trit",
      "editable": false,
      "sha256": "c7becd48c57ea2e658e5f93cc96be620657c9bcea154c33a689bfe89ecdf9c4a"
    },
    {
      "path": "src/finalize.trit",
      "editable": true,
      "sha256": "6d0f2b3cf5708cb7be2be99ddeeeaf6a0a9be0e11999679b085c1e97920949c1"
    },
    {
      "path": "src/normalize.trit",
      "editable": true,
      "sha256": "d2d8d1e166b192200696b127f2dfdead029b101e95d48d439862799621b9dcaa"
    },
    {
      "path": "src/transition.trit",
      "editable": true,
      "sha256": "83188116c7bdbff37f09f37554e66f1f0f6d2b7421d8f0dbbb81138d4d4402c6"
    }
  ],
  "limits": {
    "wall_clock_ms": 1200000,
    "cpu_ms": 1200000,
    "memory_mb": 512,
    "process_count": 8,
    "output_bytes": 262144,
    "maximum_changed_files": 4
  }
}
