{
  "schema": "treatcode.intelligence.repository-task.v3.1",
  "version": "3.1",
  "task_id": "TC-V31-PILOT-025",
  "title": "Service lifecycle handoff",
  "phase": "pilot",
  "initial_signal": "Restart recovery restores process state but duplicates one device lease and loses the original failure cause.",
  "known_failing_command_id": "pilot.public",
  "public_command_ids": [
    "pilot.public"
  ],
  "required_trit_change": true,
  "files": [
    {
      "path": "bridge/contract.ts",
      "editable": true,
      "sha256": "2a2a3bc7712d7a4635e28000327521bd990a02142a039c1e0e1b90bf157a9dd5"
    },
    {
      "path": "build/task-config.json",
      "editable": false,
      "sha256": "2deeacba131103157b09592f4174f99f82daa15aed5a7bfd7372c7c3493e7f5f"
    },
    {
      "path": "public/cases.json",
      "editable": false,
      "sha256": "fb00e78f6be9bea10b5c5554f99ca47ca42292342b8fd7a6fb44bc2dd08ab5a7"
    },
    {
      "path": "README.md",
      "editable": false,
      "sha256": "7ef47157a0bae0a084e7853fe7f7a7cf0d9f181ba47c199f6367be2786bf277e"
    },
    {
      "path": "src/distractor.trit",
      "editable": false,
      "sha256": "86492deb8e58bd3e07d1a618e00d2cf37e43b2f0b152fe371ea76f76c7dca659"
    },
    {
      "path": "src/finalize.trit",
      "editable": true,
      "sha256": "9e9bdb339b638fb5236eb1bf0a4777e41ee83b3fcc516a6c6e97806129260cc9"
    },
    {
      "path": "src/normalize.trit",
      "editable": true,
      "sha256": "6fcc5797d1da70c93445ffa7ff93e80d09bb5c90c4160e6c2a196060475baf27"
    },
    {
      "path": "src/transition.trit",
      "editable": true,
      "sha256": "8209bc2f5bd4cfe5d5d0bcf6f75b1786274f6a183d3bc2e6a977092547fe9f2a"
    }
  ],
  "limits": {
    "wall_clock_ms": 1200000,
    "cpu_ms": 1200000,
    "memory_mb": 512,
    "process_count": 8,
    "output_bytes": 262144,
    "maximum_changed_files": 4
  }
}
